{
  "schemaVersion": 1,
  "kind": "ArtifactPromoted",
  "recordedAt": "2026-10-15T12:23:57Z",
  "source": {
    "type": "github-actions",
    "workflow": "promote from quarantine / quarantine/node",
    "runUrl": "https://github.com/toddysm/cssc-framework/actions/runs/38734239904",
    "runId": "38734239904",
    "runAttempt": "1"
  },
  "from": {
    "registry": "ghcr.io",
    "repository": "toddysm/quarantine/node",
    "digest": "sha256:2c42ceffb363171d0aab4de7ba993013beb911c536113fd95f125ae1ceb6ba92"
  },
  "to": {
    "registry": "ghcr.io",
    "repository": "toddysm/base/node",
    "digest": "sha256:2c42ceffb363171d0aab4de7ba993013beb911c536113fd95f125ae1ceb6ba92"
  },
  "tag": "sha256-6f08a523443ddedf52941874c203475b0ad503e859ad70cb26ab8be9a517dbd5",
  "id": "sha256:b5ecab00a850052deac338aee34e58ad14fbd64d84bbd417f0e73cafeaa0a4aa"
}
