{
  "schemaVersion": 1,
  "kind": "ArtifactPromoted",
  "recordedAt": "2026-09-23T12:30:20Z",
  "source": {
    "type": "github-actions",
    "workflow": "promote from quarantine / quarantine/node",
    "runUrl": "https://github.com/toddysm/cssc-framework/actions/runs/35860808145",
    "runId": "35860808145",
    "runAttempt": "1"
  },
  "from": {
    "registry": "ghcr.io",
    "repository": "toddysm/quarantine/node",
    "digest": "sha256:0b36e8c136b94cd4fcf02188228e76c31ad5872eef3fec8cbd2eee500cfd9e80"
  },
  "to": {
    "registry": "ghcr.io",
    "repository": "toddysm/base/node",
    "digest": "sha256:0b36e8c136b94cd4fcf02188228e76c31ad5872eef3fec8cbd2eee500cfd9e80"
  },
  "tag": "26-alpine",
  "id": "sha256:cf3d5822715b32d69177e7b7064bd6a902cbd2d440ca776d5ae7e1d3acca25b6"
}
