{
  "schemaVersion": 1,
  "kind": "ArtifactPromoted",
  "recordedAt": "2026-10-06T13:46:07Z",
  "source": {
    "type": "github-actions",
    "workflow": "promote from quarantine / quarantine/python",
    "runUrl": "https://github.com/toddysm/cssc-framework/actions/runs/37473351719",
    "runId": "37473351719",
    "runAttempt": "1"
  },
  "from": {
    "registry": "ghcr.io",
    "repository": "toddysm/quarantine/python",
    "digest": "sha256:bf7e41408d31ffc2bc908d593c7e68bc8b49a6dd60f44532d901cf563f77e1c5"
  },
  "to": {
    "registry": "ghcr.io",
    "repository": "toddysm/golden/python",
    "digest": "sha256:bf7e41408d31ffc2bc908d593c7e68bc8b49a6dd60f44532d901cf563f77e1c5"
  },
  "tag": "sha256-952db3a8cdafdd8c635a18f1a30e4b6a0cfb5f3e9737741e634c25f6699a908f",
  "id": "sha256:90a46ab6a0fec1a494abfef23834535ede0ca5b9d5e477064a1536195af5cfef"
}
