{
  "schemaVersion": 1,
  "kind": "ArtifactPromoted",
  "recordedAt": "2026-10-09T14:04:17Z",
  "source": {
    "type": "github-actions",
    "workflow": "promote from quarantine / quarantine/node",
    "runUrl": "https://github.com/toddysm/cssc-framework/actions/runs/37941368401",
    "runId": "37941368401",
    "runAttempt": "1"
  },
  "from": {
    "registry": "ghcr.io",
    "repository": "toddysm/quarantine/node",
    "digest": "sha256:9a8e7c36cbd7432ad02daa3d4b681b603d3000974190975d14c6318c26956673"
  },
  "to": {
    "registry": "ghcr.io",
    "repository": "toddysm/base/node",
    "digest": "sha256:9a8e7c36cbd7432ad02daa3d4b681b603d3000974190975d14c6318c26956673"
  },
  "tag": "sha256-7b6a85d8b6e3c3d931431979884a97b99bad974cc686097915cec3c07d462ad7",
  "id": "sha256:44ef8e8e2671a8010658dce6d37052571ce5afa8447c4594a0394934f8be61a8"
}
