{
  "schemaVersion": 1,
  "kind": "ArtifactPromoted",
  "recordedAt": "2026-09-19T11:42:41Z",
  "source": {
    "type": "github-actions",
    "workflow": "promote from quarantine / quarantine/python",
    "runUrl": "https://github.com/toddysm/cssc-framework/actions/runs/35440827419",
    "runId": "35440827419",
    "runAttempt": "1"
  },
  "from": {
    "registry": "ghcr.io",
    "repository": "toddysm/quarantine/python",
    "digest": "sha256:2681b9a49073c1451ca055b2622b329d8f6738f1046852d51d0e5898b7fdfcf7"
  },
  "to": {
    "registry": "ghcr.io",
    "repository": "toddysm/golden/python",
    "digest": "sha256:2681b9a49073c1451ca055b2622b329d8f6738f1046852d51d0e5898b7fdfcf7"
  },
  "tag": "sha256-a205dc9270ef4f707545b77fea3734eb8622ed5e6db8ad24ceb13bdd149f46fd",
  "id": "sha256:79ccac878ecc19174678b79f729d28b27b869549de7962e2866e97a61b8da128"
}
