{
  "schemaVersion": 1,
  "kind": "ArtifactPromoted",
  "recordedAt": "2026-10-06T13:46:16Z",
  "source": {
    "type": "github-actions",
    "workflow": "promote from quarantine / quarantine/python",
    "runUrl": "https://github.com/toddysm/cssc-framework/actions/runs/37473351719",
    "runId": "37473351719",
    "runAttempt": "1"
  },
  "from": {
    "registry": "ghcr.io",
    "repository": "toddysm/quarantine/python",
    "digest": "sha256:20cb44cf15c73c051e6a8a0022b17050ef1229fba8c92c7426c1a58136432fbd"
  },
  "to": {
    "registry": "ghcr.io",
    "repository": "toddysm/golden/python",
    "digest": "sha256:20cb44cf15c73c051e6a8a0022b17050ef1229fba8c92c7426c1a58136432fbd"
  },
  "tag": "sha256-9d2a631d044769963ee27e56ed1d2de1adf64f108529e3d2de7d829cb2967806",
  "id": "sha256:a19cb63e3a4ae7bd5d1b25dcf84998b9a656608fa23ef5b2fc2fceda407f54f3"
}
