{
  "schemaVersion": 1,
  "kind": "ArtifactPromoted",
  "recordedAt": "2026-10-22T12:37:05Z",
  "source": {
    "type": "github-actions",
    "workflow": "promote from quarantine / quarantine/python",
    "runUrl": "https://github.com/toddysm/cssc-framework/actions/runs/39779738787",
    "runId": "39779738787",
    "runAttempt": "1"
  },
  "from": {
    "registry": "ghcr.io",
    "repository": "toddysm/quarantine/python",
    "digest": "sha256:c089da076bef3d450152e197dfb7585a125bcf7d29a16495a6af8e8a8bbadf31"
  },
  "to": {
    "registry": "ghcr.io",
    "repository": "toddysm/golden/python",
    "digest": "sha256:c089da076bef3d450152e197dfb7585a125bcf7d29a16495a6af8e8a8bbadf31"
  },
  "tag": "sha256-098f04982f007df4d06640bfb03de834fcae197f3ee3bc5677e75b65fd9afc86",
  "id": "sha256:7a7d85678e5b5d3e9959ce1ee0a0a0329e08d26987420ed1007bec35bd00eabb"
}
