{
  "schemaVersion": 1,
  "kind": "ArtifactPromoted",
  "recordedAt": "2026-10-02T13:20:40Z",
  "source": {
    "type": "github-actions",
    "workflow": "promote from quarantine / quarantine/python",
    "runUrl": "https://github.com/toddysm/cssc-framework/actions/runs/37012297184",
    "runId": "37012297184",
    "runAttempt": "1"
  },
  "from": {
    "registry": "ghcr.io",
    "repository": "toddysm/quarantine/python",
    "digest": "sha256:fb4c50059fa249604c89e5c7155c6980e3a86dc880ea443d90384e15af7bc714"
  },
  "to": {
    "registry": "ghcr.io",
    "repository": "toddysm/golden/python",
    "digest": "sha256:fb4c50059fa249604c89e5c7155c6980e3a86dc880ea443d90384e15af7bc714"
  },
  "tag": "sha256-198cb605c88949738eafbb897978309ec7a2ea3b864da8f30d027ff48a6f28b6",
  "id": "sha256:482e4830647fb5ff753ba960eda5ad6708700c4f22d77ae90870fe01ce7ae12f"
}
