{
  "schemaVersion": 1,
  "kind": "ArtifactPromoted",
  "recordedAt": "2026-08-11T08:09:48Z",
  "source": {
    "type": "github-actions",
    "workflow": "promote from quarantine / quarantine/openjdk",
    "runUrl": "https://github.com/toddysm/cssc-framework/actions/runs/31471967809",
    "runId": "31471967809",
    "runAttempt": "1"
  },
  "from": {
    "registry": "ghcr.io",
    "repository": "toddysm/quarantine/openjdk",
    "digest": "sha256:fcedfa6ba19abe2bacba87a540b64ff660726bc1fb70aa15a4454eab236ffb2b"
  },
  "to": {
    "registry": "ghcr.io",
    "repository": "toddysm/golden/openjdk",
    "digest": "sha256:fcedfa6ba19abe2bacba87a540b64ff660726bc1fb70aa15a4454eab236ffb2b"
  },
  "tag": "sha256-51aaaaf85a0f4916dff7e464e18cc47c3b8378448b638492efe1dec002059817",
  "id": "sha256:002415683c74db9f9f2194e2d64e96a0a1743bd00c976253a5af457f1b90052f"
}
