{
  "schemaVersion": 1,
  "kind": "ArtifactPromoted",
  "recordedAt": "2026-08-28T19:08:48Z",
  "source": {
    "type": "github-actions",
    "workflow": "promote from quarantine / quarantine/python",
    "runUrl": "https://github.com/toddysm/cssc-framework/actions/runs/33202504799",
    "runId": "33202504799",
    "runAttempt": "1"
  },
  "from": {
    "registry": "ghcr.io",
    "repository": "toddysm/quarantine/python",
    "digest": "sha256:a7fcace098005d5edc665f53456293d0297669cd3afae99e760d4a9098260954"
  },
  "to": {
    "registry": "ghcr.io",
    "repository": "toddysm/golden/python",
    "digest": "sha256:a7fcace098005d5edc665f53456293d0297669cd3afae99e760d4a9098260954"
  },
  "tag": "sha256-145ee7a57727c5ec47a1ef5e9e78b774c3873f845f2f5d61d0658e0f38234b40",
  "id": "sha256:9ded240b845a70930271236a24543e3408687d3f8f8699427a4dd7e54fd73dfe"
}
